{"items":[{"asset_id":"char-analyst","asset_type":"character","is_placeholder":true,"license":{"attribution_required":false,"spdx_id":"LicenseRef-proprietary"},"metadata":{"license_type":"proprietary_cleared","retrieval_date":"1970-01-01T00:00:00Z"},"producer":"media/resolvers/local","schema_id":"urn:media:resolved-asset","schema_version":"1.0.0","source":{"type":"generated_placeholder"},"uri":"placeholder://character/analyst"},{"asset_id":"char-commander","asset_type":"character","is_placeholder":true,"license":{"attribution_required":false,"spdx_id":"LicenseRef-proprietary"},"metadata":{"license_type":"proprietary_cleared","retrieval_date":"1970-01-01T00:00:00Z"},"producer":"media/resolvers/local","schema_id":"urn:media:resolved-asset","schema_version":"1.0.0","source":{"type":"generated_placeholder"},"uri":"placeholder://character/commander"},{"asset_id":"bg-scene-001","asset_type":"background","is_placeholder":true,"license":{"attribution_required":false,"spdx_id":"LicenseRef-proprietary"},"metadata":{"license_type":"proprietary_cleared","retrieval_date":"1970-01-01T00:00:00Z"},"producer":"media/resolvers/local","schema_id":"urn:media:resolved-asset","schema_version":"1.0.0","source":{"type":"generated_placeholder"},"uri":"placeholder://background/scene-001"},{"asset_id":"bg-scene-002","asset_type":"background","is_placeholder":true,"license":{"attribution_required":false,"spdx_id":"LicenseRef-proprietary"},"metadata":{"license_type":"proprietary_cleared","retrieval_date":"1970-01-01T00:00:00Z"},"producer":"media/resolvers/local","schema_id":"urn:media:resolved-asset","schema_version":"1.0.0","source":{"type":"generated_placeholder"},"uri":"placeholder://background/scene-002"},{"asset_id":"vo-scene-001-commander-000","asset_type":"vo","is_placeholder":true,"license":{"attribution_required":false,"spdx_id":"LicenseRef-generated"},"metadata":{"license_type":"generated_local","retrieval_date":"1970-01-01T00:00:00Z"},"producer":"media/resolvers/local","schema_id":"urn:media:resolved-asset","schema_version":"1.0.0","source":{"type":"generated_placeholder"},"uri":"placeholder://vo/vo-scene-001-commander-000"},{"asset_id":"vo-scene-001-analyst-001","asset_type":"vo","is_placeholder":true,"license":{"attribution_required":false,"spdx_id":"LicenseRef-generated"},"metadata":{"license_type":"generated_local","retrieval_date":"1970-01-01T00:00:00Z"},"producer":"media/resolvers/local","schema_id":"urn:media:resolved-asset","schema_version":"1.0.0","source":{"type":"generated_placeholder"},"uri":"placeholder://vo/vo-scene-001-analyst-001"},{"asset_id":"vo-scene-002-commander-002","asset_type":"vo","is_placeholder":true,"license":{"attribution_required":false,"spdx_id":"LicenseRef-generated"},"metadata":{"license_type":"generated_local","retrieval_date":"1970-01-01T00:00:00Z"},"producer":"media/resolvers/local","schema_id":"urn:media:resolved-asset","schema_version":"1.0.0","source":{"type":"generated_placeholder"},"uri":"placeholder://vo/vo-scene-002-commander-002"}],"manifest_id":"manifest-phase0-demo-example","project_id":"phase0-demo","schema_id":"AssetManifest_final","schema_version":"1.0.0","shotlist_ref":"shotlist-phase0-demo-example"}
